{
  "script_id": "01001016",
  "title": "牧羊卷",
  "collection_id": "01000000",
  "collection_name": "戏考",
  "metadata": {
    "source_pdf": "01001016_牧羊卷.pdf",
    "parse_version": "1.0",
    "parsed_at": "2026-06-02T04:33:26.013808+00:00",
    "page_count": 8,
    "char_count": 4725,
    "parse_quality": 0.949,
    "ocr_used": false,
    "warnings": []
  },
  "characters": [
    {
      "character_id": "c_朱春登",
      "name": "朱春登",
      "aliases": [],
      "hangdang_labeled": "老生",
      "hangdang_inferred": null,
      "hangdang_coarse": "生",
      "traits": {
        "performance_cues": [
          "念",
          "唱"
        ]
      },
      "line_count": 77,
      "first_appearance_block": 39,
      "is_main": true
    },
    {
      "character_id": "c_赵锦堂",
      "name": "赵锦堂",
      "aliases": [],
      "hangdang_labeled": "正旦",
      "hangdang_inferred": null,
      "hangdang_coarse": "旦",
      "traits": {
        "performance_cues": [
          "念",
          "唱"
        ]
      },
      "line_count": 58,
      "first_appearance_block": 96,
      "is_main": true
    },
    {
      "character_id": "c_中军",
      "name": "中军",
      "aliases": [],
      "hangdang_labeled": "净",
      "hangdang_inferred": null,
      "hangdang_coarse": "净",
      "traits": {
        "performance_cues": [
          "念"
        ]
      },
      "line_count": 32,
      "first_appearance_block": 31,
      "is_main": true
    },
    {
      "character_id": "c_朱母",
      "name": "朱母",
      "aliases": [],
      "hangdang_labeled": "老旦",
      "hangdang_inferred": null,
      "hangdang_coarse": "旦",
      "traits": {
        "performance_cues": [
          "念",
          "唱"
        ]
      },
      "line_count": 25,
      "first_appearance_block": 93,
      "is_main": true
    },
    {
      "character_id": "c_衙役甲",
      "name": "衙役甲",
      "aliases": [],
      "hangdang_labeled": "丑",
      "hangdang_inferred": null,
      "hangdang_coarse": "丑",
      "traits": {
        "performance_cues": [
          "念"
        ]
      },
      "line_count": 23,
      "first_appearance_block": 20,
      "is_main": true
    },
    {
      "character_id": "c_朱春科",
      "name": "朱春科",
      "aliases": [],
      "hangdang_labeled": "小生",
      "hangdang_inferred": null,
      "hangdang_coarse": "生",
      "traits": {
        "performance_cues": [
          "念"
        ]
      },
      "line_count": 14,
      "first_appearance_block": 68,
      "is_main": false
    },
    {
      "character_id": "c_衙役乙",
      "name": "衙役乙",
      "aliases": [],
      "hangdang_labeled": "丑",
      "hangdang_inferred": null,
      "hangdang_coarse": "丑",
      "traits": {
        "performance_cues": [
          "念"
        ]
      },
      "line_count": 12,
      "first_appearance_block": 21,
      "is_main": false
    },
    {
      "character_id": "c_宋氏",
      "name": "宋氏",
      "aliases": [],
      "hangdang_labeled": null,
      "hangdang_inferred": null,
      "hangdang_coarse": null,
      "traits": {
        "performance_cues": [
          "念"
        ]
      },
      "line_count": 11,
      "first_appearance_block": 37,
      "is_main": false
    },
    {
      "character_id": "c_二衙役",
      "name": "二衙役",
      "aliases": [],
      "hangdang_labeled": null,
      "hangdang_inferred": null,
      "hangdang_coarse": null,
      "traits": {
        "performance_cues": [
          "念"
        ]
      },
      "line_count": 8,
      "first_appearance_block": 19,
      "is_main": false
    },
    {
      "character_id": "c_厨房",
      "name": "厨房",
      "aliases": [],
      "hangdang_labeled": null,
      "hangdang_inferred": null,
      "hangdang_coarse": null,
      "traits": {
        "performance_cues": [
          "念"
        ]
      },
      "line_count": 2,
      "first_appearance_block": 135,
      "is_main": false
    }
  ],
  "scenes": [
    {
      "scene_id": "s_1",
      "scene_index": 1,
      "title": "全剧",
      "block_range": [
        0,
        376
      ],
      "character_ids": [
        "c_中军",
        "c_二衙役",
        "c_厨房",
        "c_宋氏",
        "c_朱春登",
        "c_朱春科",
        "c_朱母",
        "c_衙役乙",
        "c_衙役甲",
        "c_赵锦堂"
      ]
    }
  ],
  "blocks": [
    {
      "block_id": "b_0",
      "block_index": 0,
      "scene_id": null,
      "type": "stage_direction",
      "speaker_id": null,
      "text": "（一名：《席棚会妻》；一名：《双槐树》）",
      "performance_tags": [],
      "char_len": 20,
      "page_no": 1
    },
    {
      "block_id": "b_1",
      "block_index": 1,
      "scene_id": null,
      "type": "character_list",
      "speaker_id": null,
      "text": "主要角色",
      "performance_tags": [],
      "char_len": 4,
      "page_no": 1
    },
    {
      "block_id": "b_2",
      "block_index": 2,
      "scene_id": null,
      "type": "character_list",
      "speaker_id": null,
      "text": "朱春登：老生",
      "performance_tags": [],
      "char_len": 6,
      "page_no": 1
    },
    {
      "block_id": "b_3",
      "block_index": 3,
      "scene_id": null,
      "type": "character_list",
      "speaker_id": null,
      "text": "赵锦堂：正旦",
      "performance_tags": [],
      "char_len": 6,
      "page_no": 1
    },
    {
      "block_id": "b_4",
      "block_index": 4,
      "scene_id": null,
      "type": "character_list",
      "speaker_id": null,
      "text": "朱母：老旦",
      "performance_tags": [],
      "char_len": 5,
      "page_no": 1
    },
    {
      "block_id": "b_5",
      "block_index": 5,
      "scene_id": null,
      "type": "character_list",
      "speaker_id": null,
      "text": "朱春科：小生",
      "performance_tags": [],
      "char_len": 6,
      "page_no": 1
    },
    {
      "block_id": "b_6",
      "block_index": 6,
      "scene_id": null,
      "type": "character_list",
      "speaker_id": null,
      "text": "宋氏：丑旦",
      "performance_tags": [],
      "char_len": 5,
      "page_no": 1
    },
    {
      "block_id": "b_7",
      "block_index": 7,
      "scene_id": null,
      "type": "character_list",
      "speaker_id": null,
      "text": "中军：净",
      "performance_tags": [],
      "char_len": 4,
      "page_no": 1
    },
    {
      "block_id": "b_8",
      "block_index": 8,
      "scene_id": null,
      "type": "character_list",
      "speaker_id": null,
      "text": "衙役甲：丑",
      "performance_tags": [],
      "char_len": 5,
      "page_no": 1
    },
    {
      "block_id": "b_9",
      "block_index": 9,
      "scene_id": null,
      "type": "character_list",
      "speaker_id": null,
      "text": "衙役乙：丑",
      "performance_tags": [],
      "char_len": 5,
      "page_no": 1
    },
    {
      "block_id": "b_10",
      "block_index": 10,
      "scene_id": null,
      "type": "plot_summary",
      "speaker_id": null,
      "text": "情节",
      "performance_tags": [],
      "char_len": 2,
      "page_no": 1
    },
    {
      "block_id": "b_11",
      "block_index": 11,
      "scene_id": null,
      "type": "plot_summary",
      "speaker_id": null,
      "text": "山东朱春登与弟朱春科，奉旨平西施国黄龙之乱。朱春科之母宋氏，欲谋朱春登家产，遣侄宋成候于要路截杀之。宋成正欲下手，忽遇一猎者放枪猛击，宋成大惊，只夺朱春登衣服而去。朱春登至军中，有神人赐以",
      "performance_tags": [],
      "char_len": 94,
      "page_no": 1
    },
    {
      "block_id": "b_12",
      "block_index": 12,
      "scene_id": null,
      "type": "plot_summary",
      "speaker_id": null,
      "text": "三箭，遂得荡平西施，封为平西侯，朱春科亦得忠义大夫之职。二人衣锦还乡，立斩宋成。朱春登回家，见门庭沉寂，大惊。询问婶母，则谓朱春登“出门后，老母、娇妻，因思成疾而死”，实则被其逐出，流落他",
      "performance_tags": [],
      "char_len": 94,
      "page_no": 1
    },
    {
      "block_id": "b_13",
      "block_index": 13,
      "scene_id": null,
      "type": "plot_summary",
      "speaker_id": null,
      "text": "方，沿门求乞耳。朱春登闻此噩耗，五内崩裂，以为昔之捧檄而喜者，为母也。今乃皋鱼增痛，奉倩伤神，",
      "performance_tags": [],
      "char_len": 47,
      "page_no": 1
    },
    {
      "block_id": "b_14",
      "block_index": 14,
      "scene_id": null,
      "type": "plot_summary",
      "speaker_id": null,
      "text": "虽得高官厚禄，有何生趣？遂高搭席棚，施衣拾食，以济孤寒。其母及妻赵锦堂正在行乞，有神人引至双槐树前。婆媳二人，见有施食处，即向门役丐得残羹冷汁，食毕细认双槐，确系朱氏祖墓，号啕大哭。朱春登",
      "performance_tags": [],
      "char_len": 94,
      "page_no": 1
    },
    {
      "block_id": "b_15",
      "block_index": 15,
      "scene_id": null,
      "type": "plot_summary",
      "speaker_id": null,
      "text": "闻之，唤入席棚，细询穷诘，又细玩赵锦堂之手掌，有硃砂红印，确为结发之妻，急请老母入棚，叩首谢罪，",
      "performance_tags": [],
      "char_len": 48,
      "page_no": 1
    },
    {
      "block_id": "b_16",
      "block_index": 16,
      "scene_id": null,
      "type": "plot_summary",
      "speaker_id": null,
      "text": "一家团聚，悲喜交集。朱春登诘问婶母何以下此毒手，宋氏抵赖，对天发誓，誓语未终，即被苍龙抓去。",
      "performance_tags": [],
      "char_len": 46,
      "page_no": 1
    },
    {
      "block_id": "b_17",
      "block_index": 17,
      "scene_id": null,
      "type": "plot_summary",
      "speaker_id": null,
      "text": "根据《戏考》第一册整理",
      "performance_tags": [],
      "char_len": 11,
      "page_no": 1
    },
    {
      "block_id": "b_18",
      "block_index": 18,
      "scene_id": null,
      "type": "stage_direction",
      "speaker_id": null,
      "text": "（二衙役同上。）",
      "performance_tags": [
        "做"
      ],
      "char_len": 8,
      "page_no": 1
    },
    {
      "block_id": "b_19",
      "block_index": 19,
      "scene_id": null,
      "type": "dialogue",
      "speaker_id": "c_二衙役",
      "text": "哽唬！",
      "performance_tags": [
        "念"
      ],
      "char_len": 3,
      "speaker_name_raw": "二衙役",
      "performance_cues_raw": [
        "同白"
      ],
      "page_no": 1
    },
    {
      "block_id": "b_20",
      "block_index": 20,
      "scene_id": null,
      "type": "dialogue",
      "speaker_id": "c_衙役甲",
      "text": "为人莫当差，",
      "performance_tags": [
        "念"
      ],
      "char_len": 6,
      "speaker_name_raw": "衙役甲",
      "performance_cues_raw": [
        "念"
      ],
      "page_no": 1
    },
    {
      "block_id": "b_21",
      "block_index": 21,
      "scene_id": null,
      "type": "dialogue",
      "speaker_id": "c_衙役乙",